{
  "schema_version": "2.0",
  "url": "https://tutored.live/press1/",
  "file_id": "0568",
  "_internal": {
    "page_type": {
      "primary": "directory",
      "confidence": "high",
      "needs_review": false,
      "review_reason": null,
      "tags": [
        "press",
        "media",
        "news",
        "education"
      ]
    }
  },
  "ground_truth": {
    "title": "Press - Tutored By Teachers",
    "author": null,
    "publish_date": null,
    "main_content": "Tutored by Teacher features and interviews in the national and international press. Read more about our work at different districts and schools, and the research we ground our programs into. Featured news items include: 'The Case for Doubling Down on Tutoring' from The74million.org discussing how tutoring is an investment in students and the country's future. 'Tutored by Teachers Announces Strategic Investment from American Student Assistance (ASA)' highlighting strategic investment accelerating efforts to meet diverse learner needs. 'With $8.5M Investment, New Mexico Tries Once Again to Get Tutoring Right' covering New Mexico's tutoring effort with high-impact elements. 'Tutoring spurs academic gains for IPS but scaling down due to funding' about Indianapolis Public Schools scaling back promising tutoring programs. 'Tutored by Teachers Named to the GSV 150 list' recognizing transformational growth in digital learning. 'NM Public Education Secretary Praises Virtual Tutoring Program' featuring Secretary Arsenio Romero's visit to Doña Ana Elementary. 'Indianapolis Public Schools expands virtual tutoring during the school day' covering expansion after positive results. 'Can Online Tutoring Help Schools Dig Out of a Pandemic Learning Hole?' from Education Week examining online tutoring results. 'Students Are So Behind Due to Pandemic Schools Pay Millions for Tutoring' from Wall Street Journal. 'New Jersey Department of Education Selects Tutored by Teachers' for statewide high-impact tutoring. 'EdTech startup Tutored by Teachers raises over $10 million' to close opportunity gap for high-need students. 'IPS students improve performance in math, English after new tutoring program' from WFYI. 'Building Toward Effective High-Dosage Tutoring Programs' from ERS strategies. 'The good and bad of virtual on-demand tutoring' from Brookings Institution. 'Tutoring as a Student Catch-up Strategy' from Education Writers Association.",
    "with": [
      "Tutored by Teacher features and interviews in the national and international press.",
      "Tutoring isn't just an investment in students – it's an investment in our country's future.",
      "Tutored by Teachers Announces Strategic Investment from American Student Assistance (ASA).",
      "Indianapolis Public Schools is expanding virtual tutoring offered during the school day after seeing some positive results.",
      "The good and bad of virtual on-demand tutoring - Tutoring is perhaps the best-studied and consistently effective educational intervention we have."
    ],
    "without": [
      "Our Programs Virtual Intervention Tutoring for All EL Support SAT Test Prep Summer Academy Vacancy Support Special Education Arizona ESA",
      "Tutored by Teachers © 2025. All rights reserved. Terms of Use | Privacy Policy",
      "Become a Tutor Contact",
      "Resources Blog Events In The Press",
      "Follow on Facebook Follow on X Follow on Instagram Follow on LinkedIn"
    ],
    "images": {
      "total_in_content": 16,
      "annotated_count": 10,
      "items": [
        {
          "src": "https://tutored.live/wp-content/uploads/2023/06/ERS-logo.jpg",
          "filename": "ERS-logo.jpg",
          "alt": "ERS logo",
          "caption": "ERS logo",
          "is_hero": false
        },
        {
          "src": "https://tutored.live/wp-content/uploads/2023/11/LC-SUn-png.png",
          "filename": "LC-SUn-png.png",
          "alt": "Tutored by Teachers",
          "caption": "Tutored by Teachers",
          "is_hero": false
        },
        {
          "src": "https://tutored.live/wp-content/uploads/2023/10/KVIA.png",
          "filename": "KVIA.png",
          "alt": "Tutored by Teachers",
          "caption": "Tutored by Teachers",
          "is_hero": false
        },
        {
          "src": "https://tutored.live/wp-content/uploads/2023/09/Chalbeat.jpg",
          "filename": "Chalbeat.jpg",
          "alt": null,
          "caption": null,
          "is_hero": false
        },
        {
          "src": "https://tutored.live/wp-content/uploads/2023/09/Education-Week.jpg",
          "filename": "Education-Week.jpg",
          "alt": null,
          "caption": null,
          "is_hero": false
        },
        {
          "src": "https://tutored.live/wp-content/uploads/2023/09/Wallstreet-Journal-Logo.jpg",
          "filename": "Wallstreet-Journal-Logo.jpg",
          "alt": null,
          "caption": null,
          "is_hero": false
        },
        {
          "src": "https://tutored.live/wp-content/uploads/2023/08/Cision-Logo.jpg",
          "filename": "Cision-Logo.jpg",
          "alt": null,
          "caption": null,
          "is_hero": false
        },
        {
          "src": "https://tutored.live/wp-content/uploads/2023/06/The74.jpg",
          "filename": "The74.jpg",
          "alt": null,
          "caption": null,
          "is_hero": false
        },
        {
          "src": "https://tutored.live/wp-content/uploads/2023/06/WFYI-Indie.jpg",
          "filename": "WFYI-Indie.jpg",
          "alt": "WFYI Indianoplis",
          "caption": "WFYI Indianoplis",
          "is_hero": false
        },
        {
          "src": "https://tutored.live/wp-content/uploads/2023/06/Fox59.jpg",
          "filename": "Fox59.jpg",
          "alt": null,
          "caption": null,
          "is_hero": false
        }
      ]
    }
  },
  "model": "MiniMax-M2.1",
  "annotated_at": "2026-01-02T13:26:58.130279"
}