{
  "schema_version": "2.0",
  "url": "https://merylarnett.com/live-virtual-meditation/p/monday-night-meditation-subscription",
  "file_id": "1377",
  "_internal": {
    "page_type": {
      "primary": "product",
      "confidence": "high",
      "needs_review": false,
      "review_reason": null,
      "tags": [
        "subscription",
        "meditation",
        "virtual-classes",
        "ecommerce"
      ]
    }
  },
  "ground_truth": {
    "title": "Monday Night Meditation Subscription — Meryl Arnett -  Atlanta Meditation teacher",
    "author": null,
    "publish_date": null,
    "main_content": "Monday Night Meditation Subscription - $39.00 every month. Join me each week for a live, virtual Monday night meditation class. Membership fee auto-renews each month. Cancel any time. Membership includes: Access to all live, virtual classes; Q&A time included in each class; Exclusive monthly Community Discussion sessions; Connection to an engaged and supportive community of meditators. Members receive free access to select bonus experiences not offered on the podcast. Save 10% on all workshops, retreats and special programming.",
    "with": [
      "Join me each week for a live, virtual Monday night meditation class.",
      "Membership fee auto-renews each month. Cancel any time.",
      "Access to all live, virtual classes",
      "Q&A time included in each class",
      "Members receive free access to select bonus experiences not offered on the podcast"
    ],
    "without": [
      "Skip to Content",
      "Meryl Arnett ©2018 All Rights Reserved",
      "Subscribe to receive FREE bonus meditations, nature soundscapes, book recommendations and more!",
      "Login",
      "Instagram"
    ],
    "images": {
      "total_in_content": 2,
      "annotated_count": 1,
      "items": [
        {
          "src": "https://images.squarespace-cdn.com/content/v1/5fa9a9ddc6bfed03a4acc91e/1655091072484-YNEPAU4OF1129476IY1K/MonthlyMeditationGraphic.png",
          "filename": "MonthlyMeditationGraphic.png",
          "alt": null,
          "caption": null,
          "is_hero": true
        }
      ]
    }
  },
  "model": "MiniMax-M2.1",
  "annotated_at": "2026-01-02T14:59:00.257626"
}