{
  "schema_version": "2.0",
  "url": "https://canadianhobbymetalworkers.com/threads/proxmox-or-ubuntu-or-debian-for-windows-virtualization.18571",
  "file_id": "2797",
  "_internal": {
    "page_type": {
      "primary": "forum",
      "confidence": "high",
      "needs_review": false,
      "review_reason": null,
      "tags": [
        "discussion",
        "virtualization",
        "linux",
        "windows"
      ]
    }
  },
  "ground_truth": {
    "title": "ProxMox or Ubuntu or Debian for Windows virtualization?",
    "author": "slow-poke",
    "publish_date": "2025-12-16",
    "main_content": "I want to install some yet to be determined flavor of Linux to be the main OS on a PC and then run Win7 and Win10 as virtual machines under Linux. Older laptop; SSD is 1TB, and 32GB RAM, 2nd bay for another SSD but I don't think I need to use it. Anyone here doing this and what would you suggest?\n\nResponses from forum members:\n\nAarknoid: Running proxmox with ubuntu headless and Truenas as main VMs. Ubuntu runs docker which holds Windows 10 docker, plex, media organizers, and torrent client. Windows 10 as a docker container works well for CAD software but getting GPU shared into Ubuntu was involved - only Nvidia is supported.\n\nmickeyf: Using Debian for 15 years with VirtualBox for Windows 7 with no significant issues. Debian focuses on stability with less frequent major updates. Ubuntu is a downstream derivative of Debian.\n\njcdammeyer: Tried Linux Mint on an older Windows 7 workstation. Works reasonably well with Windows-like desktop. Installed WinBoat to run Windows 10 as tabs on the Linux desktop. GeoMagic ran reasonably well but was slow - tasks taking seconds on Windows took over a minute. USB pass-through was experimental and didn't work for dongles.\n\ndjberta: Has several laptops and desktop on Mint, works well. Debian was used at work for backbone systems.\n\nPeterT: Installed Linux Mint on an old ex-Windows 7 laptop. Linux has trouble with Nvidia graphics drivers causing glitches compared to Windows. Older laptops have better odds of Linux compatibility.",
    "with": [
      "I'm running proxmox with ubuntu headless and Truenas as my main VM's.",
      "I have used Debian for the past 15(?) years or so, with BeagleBone at work before I retired.",
      "I've tried to install LinuxMint on my older WIN-7 workstation. Works reasonably well and has a desktop that mimics Windows.",
      "The only somewhat involved part was getting my GPU shared into ubuntu, Nvidia is the only one supported atm that i know of so there is that.",
      "GeoMagic ran reasonably well but the system has what was 15 years ago a high end NVIDIA GTX670."
    ],
    "without": [
      "Scam Alert. Members are reminded to NOT send money to buy anything.",
      "Log in or Register",
      "Share: Facebook Twitter LinkedIn Reddit",
      "Community platform by XenForo",
      "Tips/Techniques"
    ],
    "images": {
      "total_in_content": 10,
      "annotated_count": 4,
      "items": [
        {
          "src": "https://canadianhobbymetalworkers.com/data/attachments/82/82623-aba67126690c90f5d4cafd16d3a71f77.jpg?hash=9srxEQN664",
          "filename": "82623-aba67126690c90f5d4cafd16d3a71f77.jpg",
          "alt": "1765928704298.png",
          "caption": "Linux Mint desktop showing WinBoat virtualization interface",
          "is_hero": true
        },
        {
          "src": "https://canadianhobbymetalworkers.com/data/attachments/82/82625-ebfc7ffd54ae9cc644c9461bf0563829.jpg?hash=PlB0fBcyYF",
          "filename": "82625-ebfc7ffd54ae9cc644c9461bf0563829.jpg",
          "alt": "1765928805167.png",
          "caption": "Windows 10 running as a tab within WinBoat on Linux",
          "is_hero": false
        },
        {
          "src": "https://canadianhobbymetalworkers.com/data/attachments/82/82626-093a704bc0175c56ce2011e1621b92e7.jpg?hash=1ac-jggUYM",
          "filename": "82626-093a704bc0175c56ce2011e1621b92e7.jpg",
          "alt": "1765928871193.png",
          "caption": "WinBoat interface showing multiple tabs including Windows desktop",
          "is_hero": false
        },
        {
          "src": "https://canadianhobbymetalworkers.com/data/attachments/82/82627-d02c445917a45d6152d4293e075e4c0b.jpg?hash=9ivMl-DdsS",
          "filename": "82627-d02c445917a45d6152d4293e075e4c0b.jpg",
          "alt": "1765928957726.png",
          "caption": "Protel 99SE running in Windows virtual machine on Linux",
          "is_hero": false
        }
      ]
    }
  },
  "model": "MiniMax-M2.1",
  "annotated_at": "2026-01-02T13:59:54.141044"
}