{
  "schema_version": "2.0",
  "url": "https://www.fool.com/investing/stock-market/market-sectors/information-technology/cloud-stocks/",
  "file_id": "0386",
  "_internal": {
    "page_type": {
      "primary": "article",
      "confidence": "high",
      "needs_review": false,
      "review_reason": null,
      "tags": [
        "technology",
        "investing",
        "stocks",
        "cloud-computing",
        "finance"
      ]
    }
  },
  "ground_truth": {
    "title": "Best Cloud Computing Stocks of 2025 | The Motley Fool",
    "author": "Scott Levine",
    "publish_date": "2025-09-09",
    "main_content": "Cloud computing boomed during the 2010s, but growth in this next-gen IT industry is still in the early innings. For years, organizations around the globe have been migrating their operations to the cloud -- digital data and services stored within a remote data center and accessed via the internet. However, the rise of remote work during the COVID-19 pandemic accelerated the trend. Now, generative AI has kicked off the next wave of cloud expansion. Business research provider Grand View Research projects that spending on global cloud computing (including data center infrastructure and edge computing) will increase at a 21.2% compound annual growth rate (CAGR) from an estimated $752.4 billion in 2024 to $2.4 trillion in 2030. Cloud computing is also closely tied to other tech developments such as mobile 5G networks, the Internet of Things (IoT), and artificial intelligence (AI). The best cloud stocks to invest in are the five largest public cloud giants: Amazon (AMZN) Web Services (AWS); Microsoft (MSFT) Azure; Alphabet (GOOGL) (GOOG) Google Cloud; Oracle (ORCL) Cloud; and IBM (IBM) Cloud. Beyond those big five, seven more focused companies provide portfolio exposure to the development of the cloud: Salesforce (CRM), Adobe (ADBE), Snowflake (SNOW), Zoom Communications (ZM), ServiceNow (NOW), The Trade Desk (TTD), and DigitalOcean (DOCN).",
    "with": [
      "Cloud computing boomed during the 2010s, but growth in this next-gen IT industry is still in the early innings.",
      "Global cloud computing spending is projected to rise from $752.4 billion in 2024 to $2.4 trillion in 2030.",
      "Cloud computing is also closely tied to other tech developments such as mobile 5G networks, the Internet of Things (IoT), and artificial intelligence (AI).",
      "The five largest public cloud giants are Amazon Web Services (AWS), Microsoft Azure, Alphabet Google Cloud, Oracle Cloud, and IBM Cloud.",
      "Cloud computing's growth is driven by AI, IoT, and mobile 5G networks."
    ],
    "without": [
      "S&P 500 +194% | Stock Advisor +973%",
      "Search for a company",
      "Join The Motley Fool",
      "Top 10 Stocks to Buy Now",
      "Daily Stock Gainers"
    ],
    "images": {
      "total_in_content": 38,
      "annotated_count": 1,
      "items": [
        {
          "src": "https://m.foolcdn.com/media/dubs/original_images/slide_9_-_digital_cloud_-_source_getty.jpg?_w=3840",
          "filename": "slide_9_-_digital_cloud_-_source_getty.jpg",
          "alt": "Artist representation of the digital cloud.",
          "caption": "Image source: Getty Images.",
          "is_hero": true
        }
      ]
    }
  },
  "model": "MiniMax-M2.1",
  "annotated_at": "2026-01-02T15:13:41.377589"
}