{
  "schema_version": "2.0",
  "url": "https://www.rottentomatoes.com/browse/movies_at_home/sort:newest",
  "file_id": "0722",
  "_internal": {
    "page_type": {
      "primary": "collection",
      "confidence": "high",
      "needs_review": false,
      "review_reason": null,
      "tags": [
        "movies",
        "streaming",
        "browse",
        "discovery"
      ]
    }
  },
  "ground_truth": {
    "title": "New Movies to Stream at Home (2025) | Rotten Tomatoes",
    "author": null,
    "publish_date": null,
    "main_content": "New Movies to Stream at Home (2025) - Browse the latest movies available to stream at home. Filter by genre, rating, Tomatometer score, and streaming service. Sort by newest, popularity, or ratings. Current movies include: Roy Wood Jr.'s Very Very Very Merry Holiday Special, The Great Flood, Raat Akeli Hai: The Bansal Murders, No More Time, Breakdown: 1975, Kumail Nanjiani: Night Thoughts, The Plantation, Suffer, A Time for Bravery, My Sunshine, Timestamp. Streaming release dates in December 2025.",
    "with": [
      "New Movies to Stream at Home (2025)",
      "Filter by genre, rating, Tomatometer score, and streaming service",
      "Roy Wood Jr.'s Very Very Very Merry Holiday Special - Streaming Dec 20, 2025",
      "The Great Flood - Streaming Dec 19, 2025",
      "Sort by newest, popularity, or ratings"
    ],
    "without": [
      "By continuing, you agree to the Terms and Policies",
      "Login/signup",
      "Trending on RT",
      "Subscribe to newsletter",
      "Privacy Policy"
    ],
    "images": {
      "total_in_content": 8,
      "annotated_count": 0,
      "items": []
    }
  },
  "model": "MiniMax-M2.1",
  "annotated_at": "2026-01-02T14:04:01.113132"
}