{
  "schema_version": "2.0",
  "url": "https://messinascatering.com/9-tips-for-hosting-a-party-at-home-using-caterers/",
  "file_id": "0548",
  "_internal": {
    "page_type": {
      "primary": "article",
      "confidence": "high",
      "needs_review": false,
      "review_reason": null,
      "tags": [
        "catering",
        "entertaining",
        "home-events",
        "how-to",
        "guide"
      ]
    }
  },
  "ground_truth": {
    "title": "9 Tips for Hosting a Party at Home Using Caterers",
    "author": "Doug McEntyre",
    "publish_date": "2021-10-04",
    "main_content": "During the pandemic, we've all gotten a lot more used to doing things at home. And many of us have been spending our time at home renovating and updating our homes. Now that many of us are back to entertaining, some may still prefer the comfort and familiarity of home. And some may want to show off their newly renovated/redecorated homes! Sure, you can invite people to a restaurant or to a beautiful event space to celebrate a special event, but sometimes, having it in your home is the way to go. And while an in-home party can be warm and personal, it can also be overwhelming to plan and execute.\n\nHiring a New Orleans catering company to cater your party is the best way to get the best of both worlds — to have your party at home, and have someone else do the setup, cooking and service. This way, your guests feel the warmth and comfort of your home, and you can avoid missing the whole party by spending it in the kitchen.\n\nTip #1: Size Doesn't Matter - You can hire a full-service catering company for a small gathering as well! From an intimate sit-down dinner in your dining room to a cocktail party with passed hors d'oeuvres in the backyard, a full-service caterer can do it all inside your home.\n\nTip #2: Choose Your Menu, Then Relax - The beauty of using a caterer for your in-home party is that your work is only on the front-end. You choose the menu, then leave them to do the heavy lifting when it comes to shopping, prepping, cooking, serving and cleanup. Don't forget what might be the best reason of all—the clean-up.\n\nTip #3: Go Ahead, Be Daring - Working with an experienced, professional caterer means you can up your game on your menu and bar service. Try something you might never attempt on your own. You choose the dishes you want for your theme and your budget, not what you feel comfortable making, and let your caterer execute it to perfection!\n\nTip #4: Don't Worry About The Size Of Your Kitchen - Chances are, your kitchen will merely serve as the assembling and serving area. Most professional caterers have their own large commissary kitchens where most of the prepping and pre-cooking takes place.\n\nTip #5: Don't Run Out And Buy Extra Dinnerware And Displayware - Most professional caterers also have their own smallware, which consists of glassware, flatware, dinnerware, bar supplies, and utensils. Caterers that do lots of off-premise catering also have beautiful display ware such as platters and serving bowls.\n\nTip #6: Where To Put Everyone - For intimate sit-down dinners, you can use your own dining room table to give your event a personal feel. Larger guest lists may require renting dining tables, cocktail tables, chairs, and linens.\n\nTip #7: Consider What Level Of Service You Desire - Talk to your caterer about the level of service you'd like, and how many servers it will require. Determine if a bartender will be part of the service staff, or if the bar will be self-serve.\n\nTip #8: Establish Expectations In Advance - Since this event is in your home, you'll want to establish expectations as to what you as the host will do and provide versus what the caterer needs to do and provide.\n\nTip #9: The Most Important Ingredient? A Quality New Orleans Caterer - Whether you are having your event at a venue, or in your home, finding the right caterer can really make or break your event.",
    "with": [
      "Hiring a New Orleans catering company to cater your party is the best way to get the best of both worlds.",
      "Tip #1: Size Doesn't Matter - You can hire a full-service catering company for a small gathering as well!",
      "Tip #5: Don't Run Out And Buy Extra Dinnerware And Displayware - Most professional caterers also have their own smallware.",
      "Tip #7: Consider What Level Of Service You Desire - Talk to your caterer about the level of service you'd like.",
      "Tip #9: The Most Important Ingredient? A Quality New Orleans Caterer - Whether you are having your event at a venue, or in your home, finding the right caterer can really make or break your event."
    ],
    "without": [
      "Skip to content",
      "About | Services | Menus | Inspiration | Venues | Contact",
      "Order Online button",
      "Follow us on Facebook, X-twitter, Instagram, Tiktok",
      "READY TO START PLANNING? WE'LL REACH OUT. Submit form"
    ],
    "images": {
      "total_in_content": 13,
      "annotated_count": 6,
      "items": [
        {
          "src": "https://messinascatering.com/wp-content/uploads/2021/10/Messinas-Blogs-4.png",
          "filename": "Messinas-Blogs-4.png",
          "alt": "at home caterers",
          "caption": null,
          "is_hero": true
        },
        {
          "src": "https://messinascatering.com/wp-content/uploads/2021/10/Messinas-Blogs-2.png",
          "filename": "Messinas-Blogs-2.png",
          "alt": "in-home catering perfect salmon",
          "caption": null,
          "is_hero": false
        },
        {
          "src": "https://messinascatering.com/wp-content/uploads/2021/10/Messinas-Blogs-3.png",
          "filename": "Messinas-Blogs-3.png",
          "alt": "in-home caterers action station",
          "caption": null,
          "is_hero": false
        },
        {
          "src": "https://messinascatering.com/wp-content/uploads/2021/10/Messinas-Blogs-6.png",
          "filename": "Messinas-Blogs-6.png",
          "alt": "residential caterers displayware",
          "caption": null,
          "is_hero": false
        },
        {
          "src": "https://messinascatering.com/wp-content/uploads/2021/10/Messinas-Blogs-1.png",
          "filename": "Messinas-Blogs-1.png",
          "alt": "messina's backyard caterers",
          "caption": null,
          "is_hero": false
        },
        {
          "src": "https://messinascatering.com/wp-content/uploads/2021/10/Messinas-Blogs-5.png",
          "filename": "Messinas-Blogs-5.png",
          "alt": "messina's catering bartenders",
          "caption": null,
          "is_hero": false
        }
      ]
    }
  },
  "model": "MiniMax-M2.1",
  "annotated_at": "2026-01-02T13:23:25.854520"
}