{
  "schema_version": "2.0",
  "url": "https://smartasset.com/advisor-resources/financial-planning-business-for-sale",
  "file_id": "0772",
  "_internal": {
    "page_type": {
      "primary": "article",
      "confidence": "high",
      "needs_review": false,
      "review_reason": null,
      "tags": [
        "finance",
        "advisor",
        "business",
        "guide",
        "firm-management"
      ]
    }
  },
  "ground_truth": {
    "title": "5 Platforms to Find a Financial Planning Business for Sale",
    "author": "Rebecca Lake, CEPF®",
    "publish_date": "2025-11-07",
    "main_content": "Acquiring an existing business is one avenue to growth, but it can also meet other needs for your advisory firm. Over the past five years, 41% of registered investment advisors have engaged in mergers and acquisitions, according to Schwab's 2025 RIA Benchmarking Study. If you're interested in finding a financial planning business for sale, several platforms exist to connect sellers and buyers.\n\nMarketplace platforms link advisors who are ready to sell with advisors who are ready to buy. As you browse these platforms to find a financial planning business for sale, consider the number of listings offered, the number of advisors who use the platform, the typical assets under management (AUM) of firms featured on the site and the price you'll pay to use it.\n\n**1. Fin.Link** is an online community for financial professionals interested in mergers and acquisitions, recruiting and career development. The platform combines a listing marketplace with a social networking element, providing advisors with a personalized dashboard that enables them to connect and collaborate. Filters allow you to sort through results to find only the types of businesses you're interested in acquiring. Listings provide details about the seller's AUM, revenues fee structure and client acquisition strategies. A free subscription is available for advisors who are only interested in networking. You'll need to select the Premier or Plus plan to have access to the mergers and acquisitions (M&A) listing marketplace.\n\n**2. Succession Resource Group (SRG)** is a consulting firm that helps RIAs grow, transition and exit their businesses. It costs nothing to create a buyer profile through SRG's myCompass marketplace, which is required to express interest in listings for sale. Advisors only pay a fee when they complete an acquisition through the platform. SRG delivers regular updates to buyers featuring new listings for sale. The platform will also flag listings that are a good match for you, based on the details provided in your profile.\n\n**3. FP Transitions** is a multi-service consulting firm that assists RIAs with valuation, succession planning, and mergers and acquisitions. The listing marketplace allows you to filter by acquisition stage and firm type to find financial planning businesses for sale that align with your preferences, needs and goals. You can easily see a firm's location, AUM and revenue at a glance.\n\n**4. RIA Match** is a marketplace for advisors who are ready to buy a financial planning business, sell one or merge their firm with another advisor. The platform is a self-populated database in which advisors supply the information needed to create a profile. Advisors can share as much or as little information as they'd like. When you create a buyer profile, you tell RIA Match what you're looking for. The platform uses your information to find businesses for sale that share your objectives and values.\n\n**5. Advisory Practice Board of Exchange** is a comprehensive platform for buyers who are interested in acquiring a wealth management practice. The site features listings including complete sale, distressed sale, partial sale, sell and consult, move to acquire, merge in, and off-market opportunities. Every buyer receives a PurchasingPower rating, which indicates to sellers your ability to complete the transaction.\n\nThe five marketplaces listed above are all specific to financial advisors. Some of them offer services that go beyond helping you find a business to acquire. Outside of these options, there are many general buy and sell marketplaces you might explore including Transworld Business Advisors, DealStream, BusinessBroker and Sunbelt.\n\nFinding a financial planning business for sale isn't that difficult if you know where to look. The actual challenge is finding a business that most closely aligns with your ideal vision for an acquisition. Careful vetting and due diligence can help ensure a smooth transition as you bring new clients and business assets into the fold.",
    "with": [
      "Marketplace platforms link advisors who are ready to sell with advisors who are ready to buy.",
      "Fin.Link is an online community for financial professionals interested in mergers and acquisitions, recruiting and career development.",
      "Succession Resource Group (SRG) is a consulting firm that helps RIAs grow, transition and exit their businesses.",
      "FP Transitions is a multi-service consulting firm that assists RIAs with valuation, succession planning, and mergers and acquisitions.",
      "Finding a financial planning business for sale isn't that difficult if you know where to look."
    ],
    "without": [
      "Subscribe to our Newsletter",
      "Copyright 2025 SmartAsset",
      "Privacy Policy",
      "SmartAsset Home",
      "Grow Your AUM"
    ],
    "images": {
      "total_in_content": 17,
      "annotated_count": 3,
      "items": [
        {
          "src": "https://smartasset.com/wp-content/uploads/sites/2/2025/11/iStock-1357661140-1.jpg",
          "filename": "iStock-1357661140-1.jpg",
          "alt": "An advisor uses a platform to find a financial planning business for sale.",
          "caption": "An advisor uses a platform to find a financial planning business for sale.",
          "is_hero": true
        },
        {
          "src": "https://smartasset.com/wp-content/uploads/sites/2/2025/11/iStock-1129819918-1.jpg",
          "filename": "iStock-1129819918-1.jpg",
          "alt": "Two advisors discuss the sale of a financial planning business.",
          "caption": "Two advisors discuss the sale of a financial planning business.",
          "is_hero": false
        },
        {
          "src": "https://smartasset.com/wp-content/uploads/sites/2/2025/11/iStock-904514832.jpg",
          "filename": "iStock-904514832.jpg",
          "alt": "An advisor researches financial planning businesses for sale.",
          "caption": "An advisor researches financial planning businesses for sale.",
          "is_hero": false
        }
      ]
    }
  },
  "model": "MiniMax-M2.1",
  "annotated_at": "2026-01-02T14:17:49.408845"
}