{
  "schema_version": "2.0",
  "url": "https://worldculinaryawards.com/award/north-america-best-catering-company/2025",
  "file_id": "1134",
  "_internal": {
    "page_type": {
      "primary": "article",
      "confidence": "high",
      "needs_review": false,
      "review_reason": null,
      "tags": [
        "awards",
        "catering",
        "north-america"
      ]
    }
  },
  "ground_truth": {
    "title": "North America's Best Catering Company 2025",
    "author": null,
    "publish_date": null,
    "main_content": "It is with great pleasure that we announce the nominees for North America's Best Catering Company in the 6th annual World Culinary Awards. The winner of North America's Best Catering Company 2025 is Occasions Caterers (United States). Visit their website at occasionscaterers.com. The nominees for North America's Best Catering Company 2025 are: 24 Carrots Catering & Events (United States), Contemporary Catering (United States), LUX Catering & Events (United States), and The Catered Affair (United States). Event Partners include Forte Village Resort as Host Partner. Supporting Partners include Cvent. Media Partners include Breaking Travel News, Best in Travel Magazine, World's Leading Chefs, Virtual Restaurants, World Luxury Magazine, and Leading Restaurants of the World.",
    "with": [
      "It is with great pleasure that we announce the nominees for North America's Best Catering Company in the 6th annual World Culinary Awards.",
      "The winner of North America's Best Catering Company 2025 is Occasions Caterers (United States).",
      "The nominees for North America's Best Catering Company 2025 are: 24 Carrots Catering & Events (United States), Contemporary Catering (United States), LUX Catering & Events (United States), and The Catered Affair (United States).",
      "Forte Village Resort is the Host Partner for the event.",
      "Cvent is listed as a Supporting Partner."
    ],
    "without": [
      "Subscribe to newsletter",
      "Copyright 2020–2025 World Luxury Media Group Limited",
      "Privacy Policy",
      "Find us on Facebook",
      "Cookie notice"
    ],
    "images": {
      "total_in_content": 23,
      "annotated_count": 6,
      "items": [
        {
          "src": "https://cdn.worldculinaryawards.com/shields/7/2025-winners-shield-M.png",
          "filename": "2025-winners-shield-M.png",
          "alt": "World Culinary Awards 2025 Winner",
          "caption": "World Culinary Awards 2025 Winner",
          "is_hero": true
        },
        {
          "src": "https://cdn.worldculinaryawards.com/organisations/images/profile/16635L.jpg?v=1747669091",
          "filename": "16635L.jpg",
          "alt": "Occasions Caterers (United States)",
          "caption": "Occasions Caterers (United States)",
          "is_hero": false
        },
        {
          "src": "https://cdn.worldculinaryawards.com/organisations/images/profile/16637L.jpg?v=1725963505",
          "filename": "16637L.jpg",
          "alt": "24 Carrots Catering & Events (United States)",
          "caption": "24 Carrots Catering & Events (United States)",
          "is_hero": false
        },
        {
          "src": "https://cdn.worldculinaryawards.com/organisations/images/profile/16638L.jpg?v=1725963495",
          "filename": "16638L.jpg",
          "alt": "Contemporary Catering (United States)",
          "caption": "Contemporary Catering (United States)",
          "is_hero": false
        },
        {
          "src": "https://cdn.worldculinaryawards.com/organisations/images/profile/16639L.jpg?v=1725963526",
          "filename": "16639L.jpg",
          "alt": "LUX Catering & Events (United States)",
          "caption": "LUX Catering & Events (United States)",
          "is_hero": false
        },
        {
          "src": "https://cdn.worldculinaryawards.com/organisations/images/profile/16636L.jpg?v=1725963545",
          "filename": "16636L.jpg",
          "alt": "The Catered Affair (United States)",
          "caption": "The Catered Affair (United States)",
          "is_hero": false
        }
      ]
    }
  },
  "model": "MiniMax-M2.1",
  "annotated_at": "2026-01-02T13:44:08.282324"
}