{
  "schema_version": "2.0",
  "url": "https://help.smartsheet.com/learning-track/level-3-solutions/project-management-tutorial",
  "file_id": "2300",
  "_internal": {
    "page_type": {
      "primary": "documentation",
      "confidence": "high",
      "needs_review": false,
      "review_reason": null,
      "tags": [
        "tutorial",
        "project-management",
        "smartsheet",
        "help-center"
      ]
    }
  },
  "ground_truth": {
    "title": "Project Management Tutorial",
    "author": null,
    "publish_date": null,
    "main_content": "Smartsheet provides essential tools for effective project management to empower your teams to execute together with speed and accountability and reach successful outcomes faster. Follow these step-by-step instructions to modify project settings. Project settings are now sheet settings in table, board, and timeline views. You can access Project Settings from Gantt, grid, or table view. Use the Start date and End date columns to track the start and end dates. To use Gantt view, your sheet must have both a start date and an end date — and those dates can't be calculated with formulas. The following image shows a project's dependency settings. To enable dependencies, you must assign Predecessor and Duration columns. If your sheet doesn't already have these columns, Smartsheet automatically creates them for you. The Duration column automates scheduling task start and end dates. It represents the number of working days the task must take to complete. Follow these step-by-step instructions to create milestones in your project sheet. In the Gantt and timeline views, a diamond shape represents a milestone. You can create a milestone by setting the item's duration value to zero. Follow these step-by-step instructions to setup your parent rollup functionality in a project sheet. You can create parent rows by indenting other rows beneath them. These indented rows become child rows. The Start Date for a parent is the earliest start date from all of its child rows. The End Date is the latest end date from all its child rows. The Duration on the parent reflects the number of working days between the parent row's Start Date and End Date. The % Complete on the parent row calculates a weighted percentage based on the Duration and % Complete entered on each child row.",
    "with": [
      "Smartsheet provides essential tools for effective project management to empower your teams to execute together with speed and accountability and reach successful outcomes faster.",
      "To use Gantt view, your sheet must have both a start date and an end date — and those dates can't be calculated with formulas.",
      "To enable dependencies, you must assign Predecessor and Duration columns.",
      "In the Gantt and timeline views, a diamond shape represents a milestone.",
      "The % Complete on the parent row calculates a weighted percentage based on the Duration and % Complete entered on each child row."
    ],
    "without": [
      "Help Center",
      "Documentation",
      "Smartsheet University",
      "©2025. All Rights Reserved Smartsheet Inc.",
      "Privacy Policy"
    ],
    "images": {
      "total_in_content": 27,
      "annotated_count": 4,
      "items": [
        {
          "src": "https://i.ytimg.com/vi/_7bQQ0gYaH4/maxresdefault.jpg",
          "filename": "maxresdefault.jpg",
          "alt": null,
          "caption": "Project Management Tutorial",
          "is_hero": true
        },
        {
          "src": "https://cdn.bfldr.com/NB5M6M91/at/67wmpcch4cq4p4n5cptm77/Project_Settings_Gantt_View.jpg",
          "filename": "Project_Settings_Gantt_View.jpg",
          "alt": "Dependency settings in the Project Settings dialog",
          "caption": "Dependency settings in the Project Settings dialog",
          "is_hero": false
        },
        {
          "src": "https://cdn.bfldr.com/NB5M6M91/at/9p2sjw6jxpqg4v4vcct74g9q/Edit_Gantt_timescale_settings.jpg",
          "filename": "Edit_Gantt_timescale_settings.jpg",
          "alt": "Project Settings",
          "caption": "Project Settings",
          "is_hero": false
        },
        {
          "src": "https://cdn.bfldr.com/NB5M6M91/at/pvwz7c4mgvswtrkqt3qt86c/Milestone_symbol_in_timeline.jpg",
          "filename": "Milestone_symbol_in_timeline.jpg",
          "alt": "Milestone diamond symbol in timeline view",
          "caption": "Milestone diamond symbol in timeline view",
          "is_hero": false
        }
      ]
    }
  },
  "model": "MiniMax-M2.1",
  "annotated_at": "2026-01-02T14:30:23.029668"
}